{"$schema":"https://json-schema.org/draft/2020-12/schema","description":"Kit-rendered steps name only shipped binaries or sc_lint modules; profile and test-layer commands are consumer-owned and rendered verbatim.","type":"object","additionalProperties":false,"required":["minimum_version","profiles","ci","analyzers"],"properties":{"minimum_version":{"type":"string","pattern":"^[0-9]+\\.[0-9]+\\.[0-9]+$"},"profiles":{"description":"Consumer-owned profile command arrays; rendered verbatim.","type":"object"},"ci":{"type":"object"},"analyzers":{"type":"object"},"test":{"description":"Consumer-owned test-layer command arrays; rendered verbatim.","type":"object"},"justfile":{"type":"object","additionalProperties":false,"properties":{"windows_shell":{"type":"boolean","default":true}}}}}
