{
  "minimum_version": "0.5.0",
  "profiles": {"ci": ["sc-lint", "lint", "ci"]},
  "ci": {"os": ["linux"], "enabled": true},
  "analyzers": {
    "runtime": {"enabled": false, "reason": "no async runtime"},
    "portability": {"enabled": true, "targets": ["linux"]}
  },
  "test": {
    "unit": ["cargo", "test"],
    "integrate": ["cargo", "test", "--test", "integration"]
  }
}
